{
  "schema_version": 1,
  "family": "TAC-01..TAC-07",
  "fixture_namespace": 1,
  "status": "complete-a1-crosswalk-strict-a0-pending",
  "factions": ["alliance", "empire"],
  "viewports": [
    { "id": "640x480", "width": 640, "height": 480, "device_scale_factor": 1 },
    { "id": "1280x800-letterboxed", "width": 1280, "height": 800, "device_scale_factor": 1 }
  ],
  "scenarios": [
    {
      "slug": "battle-entry",
      "description": "Deterministic opposing one-ship, one-squadron encounter through the production tactical entry function",
      "fixture_codes": { "alliance": 65793, "empire": 66049 },
      "execution_kind": "snapshot",
      "tactical_proof": true,
      "expected_lod_resource": 2560,
      "expected_status": "battle-ready",
      "audit_cells": ["TAC-01-C001", "TAC-01-C002", "TAC-01-C003", "TAC-01-C009", "TAC-01-C011"],
      "acceptance": "Functional entry fixture only. No original tactical interface cell is accepted."
    },
    {
      "slug": "battle-entry-proof-off",
      "description": "Deterministic negative control for pixel-level tactical mesh submission evidence",
      "fixture_codes": { "alliance": 65794, "empire": 66050 },
      "execution_kind": "negative-control",
      "tactical_proof": false,
      "expected_status": "battle-ready",
      "audit_cells": [],
      "acceptance": "Test-only negative control. No original tactical interface cell is accepted."
    },
    {
      "slug": "lod-close",
      "description": "Source-derived close LOD fixture below the original 15-unit scaled-depth threshold",
      "fixture_codes": { "alliance": 65795, "empire": 66051 },
      "execution_kind": "snapshot",
      "tactical_proof": true,
      "expected_lod_resource": 2560,
      "expected_status": "battle-ready",
      "audit_cells": [],
      "acceptance": "A1 executable-rule implementation proof only. No original tactical interface cell is accepted."
    },
    {
      "slug": "lod-medium",
      "description": "Source-derived medium LOD fixture between the original 15-unit and 40-unit scaled-depth thresholds",
      "fixture_codes": { "alliance": 65796, "empire": 66052 },
      "execution_kind": "snapshot",
      "tactical_proof": true,
      "expected_lod_resource": 2561,
      "expected_status": "battle-ready",
      "audit_cells": [],
      "acceptance": "A1 executable-rule implementation proof only. No original tactical interface cell is accepted."
    },
    {
      "slug": "lod-far",
      "description": "Source-derived far LOD fixture above the original 40-unit scaled-depth threshold",
      "fixture_codes": { "alliance": 65797, "empire": 66053 },
      "execution_kind": "snapshot",
      "tactical_proof": true,
      "expected_lod_resource": 2562,
      "expected_status": "battle-ready",
      "audit_cells": [],
      "acceptance": "A1 executable-rule implementation proof only. No original tactical interface cell is accepted."
    },
    {
      "slug": "lod-journey",
      "description": "One-renderer close-medium-far-medium-close journey through the authentic tactical zoom controls",
      "fixture_codes": { "alliance": 65798, "empire": 66054 },
      "execution_kind": "journey",
      "tactical_proof": true,
      "lod_journey": true,
      "expected_lod_resource": 2560,
      "expected_lod_sequence": [2560, 2561, 2562, 2561, 2560],
      "expected_status": "battle-ready",
      "audit_cells": [],
      "acceptance": "A1 same-renderer slot-switch and no-reload implementation proof only. No original tactical interface cell is accepted."
    },
    {
      "slug": "camera-journey",
      "description": "Source-traced faction view, authored mesh transform, system-selected palette, field zoom, yaw orbit, pitch, and selected-object target journey through the original bitmap camera controls",
      "fixture_codes": { "alliance": 65799, "empire": 66055 },
      "execution_kind": "journey",
      "tactical_proof": true,
      "camera_journey": true,
      "expected_lod_resource": 2560,
      "expected_status": "battle-ready",
      "audit_cells": ["TAC-04-C006", "TAC-04-C007", "TAC-04-C008", "TAC-04-C009", "TAC-04-C010", "TAC-04-C011"],
      "acceptance": "A1 executable camera-state, authored-transform, system-palette, and bitmap-control proof only. Native A0 view comparison remains open."
    },
    {
      "slug": "production-participants",
      "description": "Live BattleSession capital ships and fighter groups rendered from exact DAT-joined tactical resources with a healthy selected-object panel, disabled and unassigned group states, hover stability, and camera-projected selection and targeting",
      "fixture_codes": { "alliance": 65800, "empire": 66056 },
      "execution_kind": "journey",
      "tactical_proof": false,
      "production_participants": true,
      "expected_status": "battle-ready",
      "audit_cells": ["TAC-01-C008", "TAC-02-C007", "TAC-02-C009", "TAC-02-C012", "TAC-03-C001", "TAC-03-C016", "TAC-03-C018", "TAC-04-C004", "TAC-04-C005"],
      "acceptance": "Provisional A1 production capital and fighter resource rendering, healthy selected-object presentation, fail-closed unassigned group interaction, hover stability, and projection-aligned interaction proof only. Object rotation, complete effects, and native A0 comparison remain open."
    },
    {
      "slug": "production-fighter-detail-journey",
      "description": "Live fighter groups cross the exact indicator, far, and close view-span thresholds through the original bitmap zoom controls without reloading either family",
      "fixture_codes": { "alliance": 65802, "empire": 66058 },
      "execution_kind": "journey",
      "tactical_proof": false,
      "production_participants": true,
      "fighter_detail_journey": true,
      "expected_status": "battle-ready",
      "audit_cells": [],
      "acceptance": "A1 same-renderer fighter-detail and cache proof only. Formation, group commands, effects, damage, and native A0 comparison remain open."
    },
    {
      "slug": "production-group-presentation",
      "description": "All eight task-force slots and all four fighter groups rendered and selected through original bitmap controls, source hotkeys, and DAT-joined RGBY fighter resources",
      "fixture_codes": { "alliance": 65803, "empire": 66059 },
      "execution_kind": "journey",
      "tactical_proof": false,
      "production_participants": true,
      "group_presentation": true,
      "expected_status": "battle-ready",
      "audit_cells": ["TAC-02-C001", "TAC-02-C002", "TAC-02-C003", "TAC-02-C004", "TAC-02-C005", "TAC-02-C006", "TAC-02-C008", "TAC-02-C010", "TAC-02-C011", "TAC-02-C013", "TAC-03-C019"],
      "acceptance": "A1 executable task-force and fighter-group presentation proof only. Native A0 comparison and the remaining tactical command surface stay open."
    },
    {
      "slug": "production-effect-presentation",
      "description": "All six executable-selected target effect families rendered as transparent, palette-bound type-303 frames on production capital positions",
      "fixture_codes": { "alliance": 65804, "empire": 66060 },
      "execution_kind": "snapshot",
      "tactical_proof": false,
      "production_participants": true,
      "effect_presentation": true,
      "expected_status": "battle-ready",
      "audit_cells": [],
      "acceptance": "A1 executable resource, frame, timing, transparency, priority, and production-position proof only. Projectile geometry, shield fields, and native A0 comparison remain open."
    },
    {
      "slug": "production-projectile-field-presentation",
      "description": "All three retained projectile mesh variants plus tractor and gravity fields rendered on live production participants with source colors, scale, interpolation, timing, and priority",
      "fixture_codes": {
        "alliance": 65805,
        "empire": 66061
      },
      "execution_kind": "snapshot",
      "tactical_proof": false,
      "production_participants": true,
      "projectile_field_presentation": true,
      "expected_status": "battle-ready",
      "audit_cells": [],
      "acceptance": "A1 executable geometry, material-selector, duration, interpolation, field-resource, lifecycle, and priority proof only. Field command timing, special weapons, and native A0 comparison remain open."
    },
    {
      "slug": "production-selected-damage-presentation",
      "description": "Source-ordinal selected-capital portrait plus live shield and hull meters rendered inside the original 1302 HUD panel",
      "fixture_codes": {
        "alliance": 65806,
        "empire": 66062
      },
      "execution_kind": "snapshot",
      "tactical_proof": false,
      "production_participants": true,
      "selected_damage_presentation": true,
      "expected_status": "battle-ready",
      "audit_cells": ["TAC-03-C002", "TAC-03-C005", "TAC-03-C006"],
      "acceptance": "A1 source-registry portrait join, original matte composition, and live damage-meter proof only. Power allocation, commands, destroyed selection, Death Star, and native A0 comparison remain open."
    },
    {
      "slug": "production-subsystem-field-command-presentation",
      "description": "All five source-quantized selected-capital condition indicators plus source-identified tractor and gravity lock state",
      "fixture_codes": {
        "alliance": 65807,
        "empire": 66063
      },
      "execution_kind": "snapshot",
      "tactical_proof": false,
      "production_participants": true,
      "subsystem_field_command_presentation": true,
      "expected_status": "battle-ready",
      "audit_cells": ["TAC-03-C007", "TAC-03-C008", "TAC-03-C009", "TAC-03-C010", "TAC-03-C011"],
      "acceptance": "A1 executable resource, quantization, placement, source-identity, capacity, priority, and frame-reset proof only. Combat-driven subsystem damage, command input, and native A0 comparison remain open."
    },
    {
      "slug": "production-live-subsystem-damage-presentation",